name_7004#0,"""Crawford"""
msn_022022_0010#0,"""Thanks to your help, we should be able to get back on our feet."""
msn_022022_0020#0,"""...Ah, also, I noticed you've spoken with Manon."""
msn_022022_0030#0,"""My apologies for having caused you any undue worry."""
msn_022022_0040#0,"""Ever since she was reinstated, Manon's been putting in a lot of hard work. I only hope she doesn't bring herself to exhaustion..."""
msn_022022_0050#0,"""It would put me at ease if you checked in on her from time to time."""
