linewindow#0,"""Items You Cannot Carry"""
text00#0,"""Items You Cannot Carry"""
text01#0,"""Sometimes you will receive items automatically, such as when you successfully complete an Emergency Code. If you exceed the item limit or your inventory is full, then any items you cannot carry will automatically be sent to your Storage."""
11_voice_NPC_5021_100#0,"""Excellent. I see you're one of the good ones. My fears were completely unfounded, then."""
text102#0,"""You can only carry so many items at one time, but if you use your Storage from time to time, you can avoid drowning in your own junk."""
text103#0,"""The default Storage can hold up to 200 items, but if you expand it, it becomes even more useful."""
text104#0,"""Heh. This reminds me of this one time in the old days, when I tried to stuff my junk into a..."""
