Title#0,"""Пришествие Аннигилятора"""
text01#0,"""Ваша цель в данном квесте - не дать Магацу войти в Широнию.<br><br>Турели поддержки появятся в ответ на изменение ситуации, и Принцесса Сукуна даст своё благословение. Работайте вместе, чтобы победить Магацу."""
text02#0,"""Это информация о условиях провала квеста.<br><br>В этой области имеется несколько больших врат. Если Магацу достигнет и разрушит последние ворота, квест будет провален.<br><br>Магацу будет призывать врагов и стрелять энергетическими снарядами из частей своего тела, пытаясь разрушить врата. Будьте внимательны к своему окружению."""
text03#0,"""Это информация о испытаниях срочных квестов.<br><br>Когда магацу соберётся выполнить особо-опасную атаку, начнётся испытание срочного квеста (EQ Trial).<br><br>Эти испытания бывают различных типов: \""Уклонение\"", \""Перехват\"" и \""Истребление\"". Реагируйте быстро, чтобы справиться с ситуацией.<br><br>Успешное завершение испытаний срочного квеста повысит ваш ранг выполненного квеста и улучшит выпадающие предметы."""
text04#0,"""Это информация о благословении принцессы Сукуны.<br><br>Во время квеста иногда принцесса Сукуна будет благославлять вас, давая силы.<br><br>Вы можете заработать очки для получения благословения, вредя Магацу уничтожением его частей и выполняя испытания срочного квеста:<br><br>\u30001-й уровень: 100 очков<br>\u30002-й уровень: 500 очков<br>\u30003-й уровень: 1000 очков"""
Title2#0,"""Явление Аннигиляторов"""
text05#0,"""Ваша цель в данном квесте - не дать Магацу войти в Широнию.<br><br>Турели поддержки появятся в ответ на изменение ситуации, и Принцесса Сукуна даст своё благословение. Работайте вместе, чтобы победить Магацу."""
