name01#0,"""Aki"""
text01#0,"""Whew, so that's how quickly you take care of business? You've done very well, <%me>."""
text02#0,"""When you've lost your cool, you want to blow off that steam as fast as you can. But always bring along your companions."""
text03#0,"""My mentor taught me that. He said if you've got cool-headed allies, they'll stop you if you're going too far."""
text04#0,"""How many times have I been saved by what my mentor taught me...?"""
text05#0,"""...Tch, I just can't help rambling on about him. Well, job done. Time to go home.."""
