name01#0,"""Patty"""
name02#0,"""Tea"""
11_voice_NPC_5014_104#0,"""...uh, Patty. Why do you arbitrarily put out these requests? I can do this on my own."""
11_voice_NPC_5013_100#0,"""Ah, don't hold back so much! Look, this person said they're going to join us!"""
text03#0,"""I've got my own business to attend to... But you're worried, Tea...that's why! This time you should go with Tea!"""
text04#0,"""I wonder if you'd stay with me..."""
text05#0,"""You can't go together with anyone else. You've got to go along with Tea! Alright, then I'm counting on you!"""
text06#0,"""...it's annoying going along with Patty's influence, but since you're here, I'm looking forward to working with you."""
