name01#0,"""Echo"""
linewindow001#0,"""You've achieved the objective for the Client Order \""A Secret Request.\"""""
11_voice_NPC_5002_104#0,"""You and Zeno… You two are so good at what you do that you want to save everyone, and you could probably do it, too."""
text02#0,"""But once you start, there's going to be no end to it. Everyone will start asking you for help."""
text03#0,"""Oh, sorry. Never mind all that. In fact, just forget I even said it."""
text04#0,"""Sorry for blabbering on like that. I have your reward waiting for you, so meet me at the usual spot, okay?"""
