ra_010620_0010#0,"""Finalmente se nos ha dado permiso para investigar más de Naberius."""
ra_010620_0020#0,"""Hasta ahora sólo hemos revisado una pequeña parte del planeta, pero parece que una investigación más exhaustiva está aprobada. Este es un caso especial, sin embargo, así que estamos por nuestra cuenta."""
ra_010620_0030#0,"""Bueno, ya que sólo vamos a un lugar para el que hemos sido aprobados, deberíamos estar bien."""
ra_010620_0040#0,"""Aparte de eso, diviértete. Estamos aquí para descubrir los secretos de este planeta."""
ra_010620_0050#0,"""Estoy seguro de que encontraremos algo. Espérame allí, ¿quieres?"""
ra_010620_0060#0,"""A.P.238/3/25"""
