name01#0,"""？？？"""
name02#0,"""？？？"""
ra_010020_0010#0,"""Kau anggota ARKS yang baru? Jadi kau juga sudah mengalami insiden besar Darker yang lalu, kan?"""
ra_010020_0020#0,"""Aku sudah menjadi ARKS sejak lama, tapi aku belum pernah mendengar kejadian seperti itu."""
ra_010020_0030#0,"""Naberius hanya punya sedikit sumber daya bernilai, karena merupakan planet tanpa Darker.<br>Dijadikan tempat untuk akhir misi, tapi..."""
ra_010020_0040#0,"""Sejak itu, aku mendengar kejadian itu terjadi perlahan-lahan.<br>Sebenarnya apa yang terjadi..."""
ra_010020_0050#0,"""...Ngomong-ngomong, aku melihat beberapa idiot yang menyesal meninggalkan seorang gadis di kerumunan Darker..."""
ra_010020_0060#0,"""Memang kejam, tapi dalam medan perang pengorbanan yang sia-sia selalu ada.<br>Aku penasaran, kapan dia akan merelakannya..."""
ra_010020_0070#0,"""A.P.238/2/21"""
