name01#0,"""???"""
name02#0,"""???"""
ra_010010_0010#0,"""Hey, listen... Back on Naberius during that last exam quest..."""
ra_010010_0020#0,"""Yeah, I was there, too. It was unreal how many Darkers there were."""
ra_010010_0030#0,"""The thing is, in the middle of a bunch of Darkers, I saw a girl."""
ra_010010_0040#0,"""Even the partner I had on the quest didn't believe me, but I really saw someone!"""
ra_010010_0050#0,"""It really looked like a girl was there."""
ra_010010_0060#0,"""Maybe it was just a dream... No, I'm sure I saw it..."""
ra_010010_0070#0,"""She was there, but I wasn't able to do anything about it..."""
ra_010010_0080#0,"""A.P.238/2/21"""
