un_012210_0010#0,"""Hey, ¿cómo has estado últimamente?"""
un_012210_0020#0,"""¿Qué aspecto tiene? Admítelo, está honrado de que un ídolo venga a hablar con usted."""
un_012210_0030#0,"""Pero esta vez, realmente tengo una razón para hablar contigo."""
un_012210_0040#0,"""Sólo me estoy asegurando de que no te hayas olvidado de tus responsabilidades como ARKS. Quería pedirle si puede completar una orden"""
un_012210_0050#0,"""¡De Verdad! Vamos, no es como si estuviera sola o algo así. ¿Por qué siempre tienen que mirarme como si fuera un bicho raro?"""
un_012210_0060#0,"""No te preocupes, incluso he preparado un pago para ti, así que muéstrame todo tu potencial."""
un_012210_0070#0,"""A.P.238/4/5"""
