name01#0,"""???"""
name02#0,"""???"""
un_010370_0010#0,"""Oh, hey partner! Are you on a quest too? I'm in the middle of one!"""
un_010370_0020#0,"""We've finally gotten access to a lot more places, so I guess this really is the beginning for me."""
un_010370_0030#0,"""You want to help? No need, I don't even know what I'm looking for really."""
un_010370_0040#0,"""It's not like I'm giving up. I really want to find it, it's just something I think I need to do myself."""
un_010370_0050#0,"""How do I put it? I guess that feels rewarding or something to that effect."""
un_010370_0060#0,"""Or does that really matter? Anyways, if I really need help, I'll ask for it."""
un_010370_0070#0,"""See you later then!"""
