name01#0,"""???"""
name02#0,"""???"""
un_010430_0010#0,"""Hey, veo que estás mejorando."""
un_010430_0020#0,"""Recientemente, no sólo los Darkers, sino también las criaturas nativas infectadas por ellos se están convirtiendo en enemigos."""
un_010430_0030#0,"""Especialmente las criaturas nativas de gran tamaño. Tienen ataques muy fuertes y son muy difíciles de derribar."""
un_010430_0040#0,"""Incluso si tenemos confianza en nuestra resistencia, tiende a disminuir con el tiempo."""
un_010430_0050#0,"""En épocas como esa tienden a querer forces que dominan el fuego...."""
un_010430_0060#0,"""Oh tal vez no. Supongo que está bien. ¡Mientras cooperemos con los ranger, los Hunter hace muy buen equipo con ellos!"""
un_010430_0070#0,"""Los forces tienen que ser protegidas por todos los demás, realmente no quiero ponerme en esa situación."""
