name01#0,"""？？？"""
name02#0,"""？？？"""
un_010400_0010#0,"""Oh, Hola, camarada. Ha habido muchos ARKS llegando a Naberius últimamente."""
un_010400_0020#0,"""Hasta ese incidente con Darkers aquí, era una rara oportunidad de encontrarse con alguien aquí."""
un_010400_0030#0,"""Pero el hecho de que hay un montón de ARKS aquí, significa que es muy peligroso. Realmente, no necesitan a nadie aquí es lo mejor."""
un_010400_0040#0,"""Si eso sucede entonces estaríamos sin un trabajo, pero la paz es mejor."""
un_010400_0050#0,"""Hm? ¿Había alguien diciendo lo mismo que yo?"""
