un_013160_0001#0,"""A.P.238/4/8"""
un_013160_0010#0,"""...Hello. You're looking well."""
un_013160_0020#0,"""...Speaking of, that Huey was planning some kind of tournament. I heard that it's coming up soon."""
un_013160_0030#0,"""...You have to form a party to participate. It's assessing our ability to fight as a team."""
un_013160_0040#0,"""...We'll have to co-operate to take on many more powerful enemies from now on, so that makes sense."""
un_013160_0050#0,"""...Um, have you decided yet?"""
un_013160_0060#0,"""...If you haven't decided yet, would you like to join me?"""
un_013160_0070#0,"""...Not that you have to decide now. On the day, just give me a call."""
un_013160_0080#0,"""...Well then, see you later."""
