un_013170_0001#0,"""A.P.238/4/8"""
un_013170_0010#0,"""Oya, ¿Quién está ahí? Oh, eres sólo tú. De acuerdo, entonces no te dispararé."""
un_013170_0020#0,"""Si empiezo antes de las festividades, me gritarán."""
un_013170_0030#0,"""Hablando de que la fiesta de batalla ARKS comenzará pronto."""
un_013170_0040#0,"""Pero sólo hay una regla molesta; Tienes que hacer equipo con alguien."""
un_013170_0050#0,"""Lisa quería volar los sesos por sí misma."""
un_013170_0060#0,"""Bueno, sólo tendré que hacer caso a las reglas."""
un_013170_0070#0,"""¿Ha decidido con quién desea emparejar? Lisa está disponible, puedes invitar a Lisa."""
un_013170_0080#0,"""Es decir, Lisa no es asustadiza, Fwufufu fufu."""
un_013170_0090#0,"""Muy bien, nos vemos luego. Volvamos a encontrarnos."""
