name01#0,"""???"""
name02#0,"""???"""
un_010320_0010#0,"""Hm, I don't sense anything in this area. Oh! Hey partner, what's up?"""
un_010320_0020#0,"""Me? I'm on a mission. A simple reconnaissance mission."""
un_010320_0030#0,"""I guess it's just grunt work, but you need to do a lot in order to get permission to go to other planets."""
un_010320_0040#0,"""People with fighting ability get permission right away, but I prefer this kind of simple, steady work."""
un_010320_0050#0,"""Since I just started ARKS, this is more than enough for now. Later!"""
