Title#0,"""Техники"""
text0001#0,"""Техники можно использовать, только когда ваш основной либо<br>под-класс “Форс” или “Тектер”, и когда у вас экипирован род,<br>ванд или талис.<br><br><yellow>Когда техника огня<c>, такая как “Foie” или “Gifoie” летит во врага<br>и поджигает его, нанося дополнительный урон."""
text0002#0,"""<yellow>Непрерывная атака техниками льда<c>, такими как “Barta” или<br>“Gibarta”, вызовет Barta Blot на поражённом враге.<br>Barta Blot двухэтапная. Если во время второго этапа Barta Blot<br>зарядить и выпустить во врага одну из выше упомянутых техник,<br>произойдёт взрыв."""
text0003#0,"""<yellow>Удар по врагу с помощью техники молнии<c>, таких как “Zonde”<br>или “Gizonde”, заставит электричество бить в ближайших врагов,<br>нанося им урон.<br><br>Выполнение определённого количества ударов данным атрибутом<br>вызовет “Zonde-clad”. В таком состоянии мощность выпущеных<br>выше упомянутых техник усилится."""
text0004#0,"""<yellow>Атрибут ветра<c> включает в себя техники<br>“Zan” и “Gizan”.<br>При изучении умения класса “Zan Gale”, у врагов попавших под удар<br>появляется “Wind Wheel”. Разрядка по таким врагам техникой ветра<br>активирует Wind Wheel и наносит дополнительный урон."""
text0005#0,"""<yellow>Атрибут света<c>включает в себя техники 、<br>“Grants” и “Gigrants”.<br>При изучении умения класса “Grants Glitter”, у врагов попавших под удар появляется “Ring of Light”. Разрядка по таким врагам техникой света активирует Ring of Light и наносит дополнительный урон."""
text0006#0,"""<yellow>Атрибут тьмы<c>включает в себя техники 、<br>“Megid” и “Gimegid”.<br>При изучении умения класса “Megid Sphere”, попадая по врагам<br>вы будете получать “Dark Bead”.<br>Таких Dark Bead может быть до 3 штук, которые можно разрядить<br>с использованием техники тьмы прямо во врага, тем самым нанеся<br>больше урона."""
