Title#0,"""Настройки подбора комнат"""
text0001#0,"""Настройки подбора комнат позволяют вам создавать команты в секциях<br><yellow>с заранее заданным паролем<c>, которым вы можете поделиться<br>с другими игроками."""
text0002#0,"""Чтобы задач пароль для комнаты, вам нужно в главном меню выбрать<br>меню “Связь”, после чего перейти в “Настройки подбора комнат”.<br><br>Чтобы вернуться к стандартному методу подбора комнат, просто<br>очистите поле ввода пароля."""
text0003#0,"""Кроме того, комнату можно создать фото-комнатой, что даст вам<br>возможность свободно создавать скриншоты и записывать видео,<br>не боясь, что вам кто-нибудь помешает, или придётся ждать<br>нужное время суток или нужную погоду."""
text0004#0,"""Если вы вдруг захотите присоедениться к комнате с паролем,<br>перейдите в секцию комнаты, после чего в меню “Настройки<br>подбора комнат” введите соответствующий пароль.<br><br><yellow>※Если член группы уже установил другой пароль, вы не сможете<br>присоедениться к этой же комнате.<br>※Нельзя присоедениться к комнате с паролем из базы ARKS.<c>"""
text0005#0,"""На базах ARKS (в городах) можно создавать фото-комнаты,<br>но со следующими ограничениями:<br><br>・NPC поддержки будут недоступны.<br>・Нельзя установить ограничение на количество слотов в комнате.<br>・Нельзя заставить членов группы перемещаться по комнатам."""
