11_voice_NPC_5003_104#0,"""I hear that people forget to set their Techniques all the time. """
text02#0,"""You can also set them in your Subpalette, but it's important to set your main ones up in your Weapon Palette."""
text03#0,"""If you forget to set them, you won't be able to use them, even if you want to! What a waste, huh?"""
text04#0,"""What about you? You're not happy just learning them, are you? You want to use Techniques, too, don't you?"""
text05#0,"""I don't want to be pushy or anything, but why don't you try setting a Tech in your Weapon Palette?"""
linewindow001#0,"""Received <yellow>Resta Lv.1<c> from Afin."""
