name01#0,"""???"""
name02#0,"""???"""
st_010660_0010#0,"""Oh? It's pretty rare to run into anyone around here."""
st_010660_0020#0,"""Hm? You're the ARKS member that I ran into the other day. It's good that you're enthusiastic."""
st_010660_0030#0,"""But this place is a little different. If you don't have any reason to be here, then you'd best head back."""
st_010660_0040#0,"""If you have reason to stay, then you had better finish up quickly."""
st_010660_0050#0,"""I considered it earlier, but where have I seen you before?"""
st_010660_0060#0,"""No, sorry. I guess it's just my imagination."""
st_010660_0070#0,"""But you sure seem calm, even here. You must be quite capable."""
st_010660_0080#0,"""Even so, don't get too far ahead of yourself, my young ARKS friend."""
st_010660_0090#0,"""If you loose sight of the big picture, you may make a grave mistake."""
st_010660_0100#0,"""Sorry. I'm old, so I tend to find myself lecturing people. I don't want people to make the same mistakes I did."""
st_010660_0110#0,"""Well then, my young friend..."""
st_010660_0120#0,"""Oh, and one last piece of advice. If you happen across a little girl, run."""
st_010660_0130#0,"""A.P.238/3/31/10:30"""
