name01#0,"""???"""
name02#0,"""???"""
un_010940_0010#0,"""Hey there! Remember to always stay alert. Up against Darkers, carelessness could be fatal."""
un_010940_0020#0,"""Since natives lack the power of photons, they are easily corrupted and used as the Darkers' advance guards... if the infection is left unchecked."""
un_010940_0030#0,"""Preventing that is our job as ARKS. It's really unfortunate, but it's the reason we must purge all infected natives."""
un_010940_0040#0,"""I, too, was full of hesitation. Slaying these creatures in the form of natives weighs heavily on my conscience."""
un_010940_0050#0,"""Just as I was struck with reservations as a young lad, it was his words that helped me. 'Jean, we have to save them...'"""
un_010940_0060#0,"""......"""
