un_010050_0010#0,"""Yo, <%me>, hasn't it been pretty peaceful lately?"""
un_010050_0020#0,"""That's not the case with all of these Darkers? That may be true from your perspective, but..."""
un_010050_0030#0,"""Compared to 10 years ago, the present situation isn't too bad."""
un_010050_0040#0,"""I must be getting old, I keep bringing up the past all the time."""
un_010050_0050#0,"""You know what I'm trying to say, right?"""
un_010050_0060#0,"""We have more allies now. And we've gotten stronger. If it comes down to it, we can protect everyone."""
