name01#0,"""???"""
name02#0,"""???"""
un_010400_0010#0,"""Ah, you must be an ARKS too. There have been a lot more of us on Naberius lately."""
un_010400_0020#0,"""Before that incident with the Darkers, it was rare to run into anybody around here."""
un_010400_0030#0,"""But the fact that there are so many ARKS here shows how dangerous it's become. Ideally, nobody would need to be here at all."""
un_010400_0040#0,"""We'd be out of a job if that happened, but that's a price worth paying for peace."""
un_010400_0050#0,"""Hm? There was someone saying the same thing as me?"""
