name01#0,"""Lisa"""
11_voice_NPC_5026_100#0,"""Well, did you enjoy slaughtering those<br>hostiles with twin machineguns?"""
text02#0,"""Twin machineguns and Gunners are<br>made for each other! Do you think you<br>got a good feel for them?"""
text03#0,"""I really love how you can get up<br>close and really watch them bleed<br>and suffer. Hee hee!"""
text04#0,"""Oh sorry, were you busy tormenting<br>hostiles? Forgive me if I got in the way."""
text05#0,"""Well, that's about it. I hope you'll<br>come back with a long list of kills!<br>Okay then! Off you go!"""
