name01#0,"""Patti"""
name02#0,"""Tea"""
11_voice_NPC_5014_100#0,"""Oh? Could it be?<br>Will you accept my request!<br>Woohoo, I can relax!"""
text02#0,"""Wrong, idiot. Your writing on the request<br>form was just illegible so they're<br>coming to ask about it, moron."""
11_voice_NPC_5014_104#0,"""The motive for the request is written there, but the purpose was omitted...<br>I'm sorry for neglecting my supervision."""
text04#0,"""Well, I mean, anyone<br>can make a mistake.<br>Don't worry about it, Tea!"""
text05#0,"""You're the idiot that made the mistake.<br>...*cough*, erm, the purpose is to clear the dragon altar mission with an S rank."""
text06#0,"""The complete mastery of the planet Amduskia dragon altar! I want you to be like, just leave the dragon altar to me!"""
text07#0,"""Honestly, we want to go with you,<br>but we've got another investigation...<br>Sorry, but good luck."""
