name01#0,"""Echo"""
text01#0,"""Whoa, I am completely exhausted now. But at least that's over!"""
text02#0,"""And I have to say, wow, you are really something else!"""
text03#0,"""I don't mean just your sheer power alone. You're also gutsy in battle and a really quick thinker. You've got it all."""
11_voice_NPC_5002_104#0,"""I don't get it. I try and I try, but in every possible area, it feels like you just keep leaving me in the dust. Is something wrong with me?"""
text05#0,"""Ugh, I guess there's no point worrying about it. Let's head home."""
