name01#0,"""Lisa"""
11_voice_NPC_5026_104#0,"""Huh? What? You mean it's over already? But my kill number is so dismally low... """
text02#0,"""It appears that you performed better than I thought you would though. All those kills... They make my mouth water."""
text03#0,"""But that's a good thing! It means you're a force to be reckoned with. For me, though, it means more competition over kills."""
text04#0,"""But as long as I can go out for some solo slaughter, I'll be just fine. I mean, what could possibly be better than that?"""
text05#0,"""Okay okay, let's get back now. I was getting a bit bored of the hostiles here, anyway."""
