ssn_013201_0010#0,"""Что ж, я поведаю вам о фотонном кварце и торинайте."""
ssn_013201_0020#0,"""Фотонный кварц - водный минерал с зазубринами, который<br>можно найти на определённых камнях. Торанинайт - минерал<br>с красивыми концетрическими полосами."""
ssn_013201_0030#0,"""Эти минералы можно использловать для заточки снаряжения."""
ssn_013201_0040#0,"""...Я же лично думаю, что их можно было бы сделать<br>прекрасным объектом для обсуждения..."""
ssn_013201_0050#0,"""Кроме того, фотонный кварц особенно необходим<br>при изготовлении мульти-оружия."""
ssn_013201_0060#0,"""Лучше всего искать их на севере Эарио.<br>Так что, как обычно, отправляйся и ищите их!"""
