text01#0,"""Yeah, that's it! That's the rod I was looking for! Thank you so much!"""
text02#0,"""Zeno gave me this when I first got into ARKS."""
text03#0,"""I've used it ever since, so it has a lot of sentimental value...<br>Ah, I'm so glad to have it back..."""
text04#0,"""Thanks again! Here's your reward. Please, take it. It was a Client Order, after all."""
11_voice_NPC_5002_101#0,"""Oh, this is a good time to give you my partner card, isn't it. Call me any time!"""
linewindow001#0,"""<br>You can now call Echo as a partner.<br>"""
