name01#0,"""???"""
name02#0,"""???"""
st_020190_0001#0,"""A.P.238/5/25/11:00"""
st_020190_0010#0,"""Let's take a break. There's not a lot of time, but we need to make them sweat a little."""
st_020190_0020#0,"""I'm always being led along by him, so it's nice to return the favor."""
st_020190_0030#0,"""Hm? Why am I so invested in what he says?"""
st_020190_0040#0,"""I guess you would you say we have the same interests, even though it was mostly forced on me."""
st_020190_0050#0,"""Not to mention that I guess I owe him, and Maria."""
st_020190_0060#0,"""Otherwise, I wouldn't even bother with all of this. Not to mention, he talks directly in my head."""
st_020190_0070#0,"""That's why before you meet him, I want to make your impression of him as bad as possible, ahead of time."""
st_020190_0080#0,"""It'd be nice that, even if he manages to say something above his class, he gets lightly laughed at for it."""
