name_7201#0,"""Somua"""
ssn_014020_0001#0,"""Ciudad Central es un lugar clave en nuestra lucha contra los DOLLS."""
ssn_014020_0002#0,"""Muchos defensores de ARKS se han reunido aquí, así que, por favor, acércate y coordíne con<br>ellos."""
ssn_014020_0101#0,"""¿Has oído hablar de los Gigantix? Dicen que son enemigos peligrosos que<br>acompañan a las tormentas."""
ssn_014020_0102#0,"""No muchos se han enfrentado a ellos, así que estamos bastante escasos de datos. ¿Estarías dispuesto a<br>ayudar a recoger algunos para remediarlo?"""
ssn_014020_0103#0,"""¿Me ayudarás? Por qué, gracias."""
ssn_014020_0104#0,"""Como he dicho antes, los Gigantix son enemigos especialmente peligrosos. No te quedes por aquí si te parecen un reto demasiado grande."""
ssn_014020_0105#0,"""Acercarse lo suficiente para confirmar su presencia es suficiente. Una vez que tengamos los datos que necesitamos, te lo haré saber."""
ssn_014020_0106#0,"""Bien entonces, la mejor de las suertes ahí fuera. Y por favor, tened cuidado."""
ssn_014020_0201#0,"""Es una pena... Si más tarde decides que quieres ayudarnos, por favor, pásate de nuevo por aquí."""
