name01#0,"""Koffie"""
text01#0,"""<%me>.<br>Great work.<br>Thank you for all your hard work. This is administrator Koffie."""
text02#0,"""In light of your recent activities, we have granted you permission to change to a new Class."""
text03#0,"""The Class is called \""Hero.\"" It is an Advanced Class designed to combat multiple enemies at once."""
text04#0,"""Due to the immense strain it places on one's body, access is only granted to ARKS who have reached a certain level."""
text05#0,"""Given all your accomplishments, I'm sure you'll master it quickly. I wish you good luck."""
