name01#0,"""Astarte"""
11_voice_shop_413#0,"""Objetivo completado. Oh, tengo informacion sobre las Matterboards."""
text02#0,"""[El Matterboard es una guia, donde se desbloquean nuevos caminos siempre que se cumplan los objetivos visualizados.]"""
text03#0,"""[Estos objetivos pueden ser, derrotar "x" enemigo, recuperar objetos o conocer a personas específicas.]"""
text04#0,"""[Cuando se cumple un objetivo, se desbloqueara el siguiente camino, avanzando la historia. Puedes avanzar a tu propio ritmo.]"""
text05#0,"""Eso es todo. Ahora voy a otorgar su sello."""
