name_7015#0,"""Meri"""
ssn_013002_0010#0,"""Thanks for helping me out here. Ilma should be back at the research laboratory."""
ssn_013002_0020#0,"""You know, the one we originally found him in. Do you remember?"""
ssn_013002_0030#0,"""The lab that's off to the side of that tunnel in Lost Central."""
ssn_013002_0040#0,"""Everyone's been so helpful to us since then, but we're just so used to doing our own thing, you know?"""
ssn_013002_0050#0,"""Ilma calls us regularly, but it's been a while since he's come back to the lodge."""
ssn_013002_0060#0,"""Even if I wanted to go and visit him, I don't know how I'd do on my own out there."""
ssn_013002_0070#0,"""I WOULD have asked one of my brothers, but they aren't responding to my calls either! Rude."""
ssn_013002_0080#0,"""So yeah, that's why I'm glad I was able to ask you. Thanks a bunch!"""
