linewindow#0,"""<br>About Teams<br>"""
text00#0,"""Teams"""
text01#0,"""You can create a Team once you have reached level 10 in any class.<br><br>Your Team forms a community, meaning that as long as someone is on your Team, you can use Team chat, and contact them even if they are in a different block or different room.<br><br>Even if you haven't achieved class level 10, you can join a Team if you are invited by someone."""
text02#0,"""On each Ship, all of your characters belong to the same Team."""
text03#0,"""Each Team Member is given a rank. You can check your rank by checking the Team Member list.<br><br><yellow>Team Leader<c><br>The Team Leader is able to perform all of the Team's functions. <br><br><yellow>Managers<c><br>Aside from performing the Team's basic functions, Managers can also scout for new members.<br><br><yellow>Members<c><br>Members can perform basic functions.<br><br><yellow>Visitors<c><br>Visitors are not yet full members, and are waiting for the Team Leader's approval. They can perform basic Team functions."""
text04#0,"""You can also disband an established Team.<br><br>When you disband a Team, all of the Team's achievements, such as the Team Points it earned, will be lost, and cannot be restored."""
text05#0,"""You can expand a Team to get access to a dedicated Team Room, or a Team Storage shared amongst all members."""
text06#0,"""To expand your Team, you need Team Points (TP). You can get Team Points by completing orders.<br><br>You can accept and hand in orders from the Team Counters in the ARKS Ship and the Team Room.."""
text07#0,"""Your ability to expand your Team increases as your Team level rises.<br>Make sure to cooperate fully with other members to create a stronger, more unique Team."""
