text01#0,"""I've seen a lot of how you fight now, senpai, so I think I'm starting to understand."""
text02#0,"""No matter what you're facing, you never flinch. You draw on all your knowledge and experience and calmly take them down."""
11_voice_NPC_5091_100#0,"""And here I am, panicking at the first sign of trouble.<br>...You're amazing, you know that?"""
text04#0,"""...So, if it's alright with you, I'd like you to take me on some of your missions."""
text05#0,"""This is my Partner Card. I hope you'll take good care of me, senpai."""
text06#0,"""Thank you, senpai. See you soon."""
