un_048800_0010#0,"""Oh, <%me>. Como Vice Comandante del Departamento de Inteligencia, he oído historias sobre lo que está pasando."""
un_048800_0020#0,"""Como de costumbre, estás envuelto en algo raro."""
un_048800_0030#0,"""Bueno, además de un veterano como tú que está acostumbrado a la batalla constante, Hitsugi y los demás no han tenido la oportunidad de relajarse, ¿verdad?"""
un_048800_0040#0,"""Así que, quiero sorprenderlos - Hacer algo para que se sientan mejor!"""
un_048800_0050#0,"""Cuando todo esto haya terminado, tendremos un gran evento en vivo que impulsará la moral de Oracle y de la Tierra."""
un_048800_0060#0,"""¡Para recompensar a aquellos que trabajaron duro con una nueva canción! Hitsugi y los demás les encantaría, ¿verdad?"""
un_048800_0070#0,"""Muy bien, impresionante! Tengo que hacer una buena canción que va a cerrar la brecha entre los dos mundos!"""
un_048800_0080#0,"""Oh, y esto es un secreto, ¡recuerda! Quiero sorprenderlos!"""
un_048800_0090#0,"""Además, este es un regalo para usted, por trabajar tan duro durante todos estos años. Asegúrese de venir y ver!"""
