name010#0,"""Fyne"""
text010#0,"""Good work! That was some nice fighting! You and Manon both, the Meteorn lately have been mighty fast learners."""
text020_PA#0,"""When you learn a new Photon Art, remember what I taught you!"""
text020_TEC#0,"""When you learn a new Technique, remember what I taught you!"""
text020_Te#0,"""When you learn a new Photon Art or Technique, remember what I taught you!"""
Text020#0,"""Here, take this. It'll heal you up good as new"""
Text030#0,"""Obtained one Resta Sign."""
Text040#0,"""Make good use of what I taught you, okay?"""
