name_7705#0,"""Lynce"""
ssn_014331_0010#0,"""Thank you. I'm so glad you've agreed."""
ssn_014331_0020#0,"""As you can see, we have many injured ARKS here."""
ssn_014331_0030#0,"""I want to keep our patients well-nourished, but our food stockpiles are dangerously low right now..."""
ssn_014331_0040#0,"""So, I'd you to go and get some Tames meat. Some good meat should help everyone recover sooner."""
ssn_014331_0050#0,"""I know I'm asking a lot, but we really need this. Take care of yourself out there."""
