ssn_014051_0010#0,"""Hehe... I'm glad. Thank you for going above and beyond."""
ssn_014051_0020#0,"""You see, recently we've detected a rather peculiar radio signal in Resol Forest."""
ssn_014051_0030#0,"""This radio signal seems to impart some sort of influence on the surrounding DOLLS."""
ssn_014051_0040#0,"""We're still very much in the dark on this... could you help us investigate it?"""
ssn_014051_0050#0,"""In order to learn more about it, we'd like you to record your combat data as you fight the affected DOLLS in question."""
ssn_014051_0060#0,"""That way, we can get some insight into what's going on. Thanks again, and good luck."""
ssn_014051_0055#0,"""We'd like you to record your combat data as you fight the DOLLS affected by radio waves. That way, we can get some insight into what's going on."""
