pr_043073_0010#0,"""Ha... hah... haha... ¡Bienvenido a mi cafe!"""
pr_043073_0020#0,"""¡Aquí es donde ayudo a los ARKS con la recolección!"""
pr_043073_0030#0,"""La recolección consiste en explorando los diversos planetas descubiertos, recolectando y pescadno en busca de ingredientes o materiales!"""
pr_043073_0040#0,"""¡Si nos suministras los materiales que has recolectado, nosotros podremos hacerte comida y Skill Rings!"""
pr_043073_0060#0,"""Si hay algo que no entiendas, por favor habla con esta persona de allí."""
pr_043073_0070#0,"""¡Dicho todo esto, cuidate!"""
