pr_043072_0010#0,"""Ha...hah...haha.... Welcome! To my cafe!"""
pr_043072_0020#0,"""It's here that I am helping ARKS with Gathering!"""
pr_043072_0030#0,"""Gathering is going exploring on different planets, Harvesting and Fishing for materials!"""
pr_043072_0040#0,"""If you bring the materials that you've collected from Gathering, we can make you Food Dishes and Skill Rings!"""
pr_043072_0060#0,"""If there's something you don't understand, please speak to this person here."""
pr_043072_0070#0,"""That said, take care!"""
