name_7006#0,"""Ran"""
ssq_014572_0010#0,"""<%me>, are you receiving me?"""
ssq_014572_0020#0,"""Based on your activities so far, you've been cleared to take part in particularly dangerous missions within the Retem Region."""
ssq_014572_0030#0,"""You'll be facing even stronger enemies than you've seen so far, so be sure to prepare yourself before you go."""
ssq_014572_0040#0,"""You can join the Independent Corps operations from any Ryuker Device, or from the World Map."""
ssq_014572_0050#0,"""With that, I wish you good luck."""
