name_7442#0,"""Chitose"""
ssn_015470_0001#0,"""Hey, thanks for your help earlier!"""
ssn_015470_0002#0,"""You and Kirishima both, thanks so much. I ain't gonna forget how much I owe you two!"""
ssn_015470_0101#0,"""Hey, good timing!"""
ssn_015470_0102#0,"""Listen, I've got this favor to ask; will ya hear me out?"""
ssn_015470_0201#0,"""So yeah, the enemies in Mediola... uh, Section 2... are all yours. I also wanna see you fight again."""
ssn_015470_0202#0,"""Thaaanks!"""
ssn_015470_0301#0,"""Awww, for real? Well, I guess it can't be helped if you're busy."""
ssn_015470_0401#0,"""I learned a lot from seeing you fight. This'll serve as a great reference."""
ssn_015470_0402#0,"""Alright, I'm gonna give it my all!!"""
