un_020630_0010#0,"""¡Corta corta corta! ¡Y una más! Ah, no importa cuánto practique, nunca cumpliré mi misión."""
un_020630_0020#0,"""Ah, ¿cuándo llegaste aquí? Me salté por completo el saludo."""
un_020630_0030#0,"""¿Justo ahora? Oh, estaba practicando mi técnica de katana. Parece que todavía me falta entrenamiento."""
un_020630_0040#0,"""Eso, y le prometí a Regius que terminaria mi entrenamiento completamente."""
un_020630_0050#0,"""Todos los días, fui y le pedí que entrenara con la katana, y finalmente cedió."""
un_020630_0060#0,"""En su raíz, que parece ser una persona genuina con pasión, así que es un poco débil hacia las personas con mentalidad individuales."""
un_020630_0070#0,"""Por lo tanto, tengo que hacer todo lo posible y estar a la altura de sus expectativas, ya que aceptó enseñarme."""
un_020630_0080#0,"""Es por eso que estoy haciendo lo mejor aquí, haciendo ruido todos los días para cumplir con mi cuota."""
