un_025085_0001#0,"""A.P.228/7/9"""
un_025085_0010#0,"""You took down a native that easily!? Amazing!"""
un_025085_0020#0,"""U-uh, my bad! I wasn't standing back watching... I just happened to be passing by."""
un_025085_0030#0,"""I heard a cry and came to check it out, but by the time I got here you already beat it!"""
un_025085_0040#0,"""You're an ARKS, ain'tcha? Can you give tips on how to be as strong as you?"""
un_025085_0050#0,"""Doing any kind of special training? What's your class alignment? Oh, and..."""
un_025085_0060#0,"""Damn it, Echo! Always cutting in at the wrong time!"""
un_025085_0070#0,"""...but, I gotta help her out. Sorry pal! Fill me in on the details next time, okay?"""
un_025085_0101#0,"""???"""
